{
  "generated_from_report": "harness/regression/slice_07_verification_report.json",
  "run_count": 1,
  "runs": [
    {
      "case_ids": [
        "provider_ref_missing_export_safe",
        "registry_cache_hit_export_success",
        "registry_live_export_success",
        "replay_export_success"
      ],
      "export_manifest_count": 4,
      "packet_classes": [
        "answer_packet",
        "policy_response_packet",
        "search_assist_packet"
      ],
      "receipt_count": 4,
      "receipt_ids": [
        "rcpt_0990c0414b9fec53",
        "rcpt_1ae7ddadb1e68689",
        "rcpt_83c93bd52dc41068",
        "rcpt_c9d30156e36fd002"
      ],
      "result_kinds": [
        "safe_failure",
        "success"
      ],
      "run_id": "run_set_4f8dd89349cfb07b",
      "source_report_path": "harness/regression/slice_07_verification_report.json"
    }
  ],
  "schema_version": "1.0.0"
}
