{
  "schema_version": "1.0.0",
  "generated_from_report": "harness/regression/slice_07_verification_report.json",
  "run_count": 1,
  "runs": [
    {
      "run_id": "run_set_11111111aaaa",
      "source_report_path": "harness/regression/slice_07_verification_report.json",
      "receipt_count": 2,
      "receipt_ids": [
        "rcpt_11111111aaaa",
        "rcpt_22222222bbbb"
      ],
      "case_ids": [
        "case_a",
        "case_b"
      ],
      "packet_classes": [
        "answer_packet",
        "policy_response_packet"
      ],
      "result_kinds": [
        "safe_failure",
        "success"
      ],
      "export_manifest_count": 2
    }
  ]
}
